{
  "event_id": "55555555-5555-4555-8555-000000000005",
  "schema_version": 1,
  "occurred_at": "2026-10-05T06:40:12Z",
  "correlation_id": "11111111-1111-4111-8111-111111111111",
  "aggregate_id": "22222222-2222-4222-8222-222222222222",
  "aggregate_version": 1,
  "event_type": "ReservationReleased",
  "data": {
    "reservation_id": "22222222-2222-4222-8222-222222222222",
    "checkout_id": "11111111-1111-4111-8111-111111111111",
    "sku": "FLASH-001",
    "quantity": 1,
    "status": "RELEASED",
    "reason": "PAYMENT_DECLINED"
  }
}
